{
  "$schema": "https://json-schema.org/draft/2020-12/schema",
  "$id": "facts-unit.schema.json",
  "title": "Facts unit — one unit's decisions over its candidates (v3 design §2.5)",
  "type": "object",
  "additionalProperties": false,
  "required": ["schema_version", "unit", "attempt", "decisions"],
  "properties": {
    "schema_version": { "const": 1 },
    "unit": { "type": "string", "minLength": 1 },
    "attempt": { "type": "integer", "minimum": 1 },
    "decisions": { "type": "array", "items": { "$ref": "#/$defs/decision" } },
    "new": { "type": "array", "items": { "$ref": "#/$defs/newEntry" } },
    "contradicted": { "type": "array", "items": { "type": "object" } }
  },
  "if": { "properties": { "unit": { "const": "review" } }, "required": ["unit"] },
  "else": { "properties": { "decisions": { "items": {
    "properties": { "action": { "not": { "const": "contradiction" } } } } } } },
  "$defs": {
    "leaf": {},
    "mintedKey": { "type": "string",
      "pattern": "^[a-z][a-z0-9]*(_[a-z0-9]+)*(__[a-z][a-z0-9]*(_[a-z0-9]+)*)*$" },
    "skeletonId": { "type": "string", "pattern": "^S-(rec|r|gs)-[0-9a-f]{12}$" },
    "homeRef": { "type": "object", "additionalProperties": false,
      "required": ["ref"],
      "properties": {
        "ref": { "type": "string", "pattern": "^(S-|N-|F-|T-)" },
        "field": { "$ref": "#/$defs/mintedKey" } } },
    "scope": { "type": "object", "additionalProperties": false,
      "properties": {
        "departments": { "type": "array", "items": { "type": "string", "pattern": "^[a-z]+$" } },
        "branches": { "type": "array", "items": { "type": "string", "pattern": "^[a-z]+$" } } } },
    "entryAddr": { "type": "object", "additionalProperties": false,
      "required": ["kind", "key"],
      "properties": {
        "kind": { "enum": ["record", "measurement", "rule", "note"] },
        "key": { "$ref": "#/$defs/mintedKey" },
        "scope": { "$ref": "#/$defs/scope" } } },
    "procCite": { "type": "object", "additionalProperties": false,
      "required": ["process", "node"],
      "properties": {
        "process": { "type": "string", "pattern": "^[a-z]+-[0-9]{3}$" },
        "node": { "type": "string" },
        "quote": { "type": "string" } } },
    "decisionField": { "type": "object", "additionalProperties": false,
      "required": ["from"],
      "properties": {
        "from": { "type": "string" },
        "key": { "$ref": "#/$defs/leaf" },
        "title": { "$ref": "#/$defs/leaf" },
        "unit": { "$ref": "#/$defs/leaf" },
        "type": { "$ref": "#/$defs/leaf" },
        "description": { "$ref": "#/$defs/leaf" },
        "derived": { "$ref": "#/$defs/leaf" },
        "group": { "type": "object", "additionalProperties": false,
          "properties": { "key": { "type": "string", "pattern": "^[a-z][a-z0-9]*(_[a-z0-9]+)*$" },
                          "title": { "type": "string" } } } } },
    "decisionData": { "type": "object", "additionalProperties": false,
      "properties": {
        "role": { "$ref": "#/$defs/leaf" },
        "grain": { "$ref": "#/$defs/leaf" },
        "cadence": { "$ref": "#/$defs/leaf" },
        "day_boundary": { "$ref": "#/$defs/leaf" },
        "filled_by": { "$ref": "#/$defs/leaf" },
        "approved_by": { "$ref": "#/$defs/leaf" },
        "movement": { "$ref": "#/$defs/leaf" },
        "reconciled_against": { "$ref": "#/$defs/leaf" },
        "primaryKey": { "$ref": "#/$defs/leaf" },
        "fields": { "type": "array", "items": { "$ref": "#/$defs/decisionField" } },
        "unit": { "$ref": "#/$defs/leaf" },
        "inputs": { "$ref": "#/$defs/leaf" },
        "outputs": { "$ref": "#/$defs/leaf" },
        "expr": { "$ref": "#/$defs/leaf" },
        "lang": { "$ref": "#/$defs/leaf" },
        "table": { "$ref": "#/$defs/leaf" },
        "text": { "$ref": "#/$defs/leaf" },
        "calls": { "$ref": "#/$defs/leaf" },
        "edge_cases": { "$ref": "#/$defs/leaf" },
        "template_of": { "$ref": "#/$defs/leaf" },
        "divergence": { "$ref": "#/$defs/leaf" } } },
    "splitPart": { "type": "object", "additionalProperties": false,
      "required": ["key", "title", "statement"],
      "properties": {
        "key": { "$ref": "#/$defs/mintedKey" },
        "title": { "type": "string" },
        "statement": { "type": "string" },
        "data": { "$ref": "#/$defs/decisionData" },
        "takes": { "type": "array", "minItems": 1,
          "items": { "$ref": "#/$defs/mintedKey" } },
        "extra": { "type": "object" } } },
    "decision": { "type": "object", "additionalProperties": false,
      "required": ["action"],
      "oneOf": [{ "required": ["skeleton"] }, { "required": ["entry"] }],
      "properties": {
        "skeleton": { "$ref": "#/$defs/skeletonId" },
        "entry": { "$ref": "#/$defs/entryAddr" },
        "action": { "enum": ["keep", "drop", "merge_into", "split", "contradiction"] },
        "key": { "$ref": "#/$defs/mintedKey" },
        "title": { "type": "string" },
        "statement": { "type": "string" },
        "aliases": { "type": "array", "items": { "type": "string" } },
        "branches": { "type": "array", "items": { "type": "string", "pattern": "^[a-z]+$" } },
        "processes": { "type": "array", "items": { "$ref": "#/$defs/procCite" } },
        "home": { "oneOf": [{ "$ref": "#/$defs/homeRef" }, { "type": "null" }] },
        "data": { "$ref": "#/$defs/decisionData" },
        "into": { "oneOf": [
          { "$ref": "#/$defs/skeletonId" },
          { "$ref": "#/$defs/entryAddr" },
          { "type": "array", "minItems": 2, "items": { "$ref": "#/$defs/splitPart" } } ] },
        "reason_code": { "enum": ["not_a_fact", "date_passthrough", "cosmetic", "duplicate",
                                   "has_a_home", "insufficient_context", "other"] },
        "reason": { "type": "string" },
        "field": { "type": "string" },
        "resolution": { "enum": ["account", "fix"] },
        "value": { "$ref": "#/$defs/leaf" },
        "extra": { "type": "object" } },
      "allOf": [
        { "if": { "properties": { "action": { "const": "keep" } }, "required": ["action"] },
          "then": { "required": ["key", "title", "statement"] } },
        { "if": { "properties": { "action": { "const": "drop" } }, "required": ["action"] },
          "then": { "required": ["reason_code"] } },
        { "if": { "properties": { "action": { "const": "merge_into" } }, "required": ["action"] },
          "then": { "required": ["reason_code", "into"],
                    "properties": { "into": { "oneOf": [{ "$ref": "#/$defs/skeletonId" },
                                                        { "$ref": "#/$defs/entryAddr" }] } } } },
        { "if": { "properties": { "action": { "const": "split" } }, "required": ["action"] },
          "then": { "required": ["reason_code", "into"],
                    "properties": { "into": { "type": "array", "minItems": 2,
                                              "items": { "$ref": "#/$defs/splitPart" } } } } },
        { "if": { "properties": { "action": { "const": "contradiction" } }, "required": ["action"] },
          "then": { "required": ["field", "resolution"] } },
        { "if": { "properties": { "action": { "const": "contradiction" } }, "required": ["action"] },
          "then": { "required": ["entry"] } } ] },
    "newEntry": { "type": "object", "additionalProperties": false,
      "required": ["kind", "key", "title", "statement", "data"],
      "properties": {
        "kind": { "enum": ["record", "measurement", "rule", "note"] },
        "key": { "$ref": "#/$defs/mintedKey" },
        "title": { "type": "string" },
        "statement": { "type": "string" },
        "aliases": { "type": "array", "items": { "type": "string" } },
        "branches": { "type": "array", "items": { "type": "string", "pattern": "^[a-z]+$" } },
        "processes": { "type": "array", "items": { "$ref": "#/$defs/procCite" } },
        "home": { "oneOf": [{ "$ref": "#/$defs/homeRef" }, { "type": "null" }] },
        "data": { "type": "object" },
        "extra": { "type": "object" } } }
  }
}
