{
 "schema_version": 1,
 "unit": "u-wb-mavade_avalie-s10",
 "attempt": 1,
 "decisions": [
  {
   "skeleton": "S-rec-f344ac88fcd5",
   "action": "keep",
   "key": "mavad_starter",
   "title": "مواد اولیهٔ استارتر",
   "statement": "مقدار هر ماده اولیه برای هر غذای گروه استارتر در این جدول نگهداری می‌شود.",
   "data": {
    "role": "reference",
    "primaryKey": [
     "c_a"
    ],
    "grain": "هر غذای این گروه"
   }
  }
 ]
}
