{
 "schema_version": 1,
 "unit": "u-wb-mavade_avalie-s3",
 "attempt": 1,
 "decisions": [
  {
   "skeleton": "S-rec-bf477559ad68",
   "action": "keep",
   "key": "mavad_pitza_singel",
   "title": "مواد اولیهٔ پیتزا سینگل",
   "statement": "مقدار هر ماده اولیه برای هر غذای گروه پیتزا سینگل در این جدول نگهداری می‌شود.",
   "data": {
    "role": "reference",
    "primaryKey": [
     "c_a"
    ],
    "grain": "هر غذای این گروه"
   }
  }
 ]
}
