{
 "schema_version": 1,
 "unit": "u-wb-mavade_avalie-s6",
 "attempt": 1,
 "decisions": [
  {
   "skeleton": "S-rec-24886a08d4ab",
   "action": "keep",
   "key": "mavad_pasta",
   "title": "مواد اولیهٔ پاستا",
   "statement": "مقدار هر ماده اولیه برای هر غذای گروه پاستا در این جدول نگهداری می‌شود.",
   "data": {
    "role": "reference",
    "primaryKey": [
     "c_a"
    ],
    "grain": "هر غذای این گروه"
   }
  }
 ]
}
