{
 "schema_version": 1,
 "unit": "u-wb-mavade_avalie-s8",
 "attempt": 1,
 "decisions": [
  {
   "skeleton": "S-rec-87b94d2711a8",
   "action": "keep",
   "key": "mavad_sokhari",
   "title": "مواد اولیهٔ سوخاری",
   "statement": "مقدار هر ماده اولیه برای هر غذای گروه سوخاری در این جدول نگهداری می‌شود.",
   "data": {
    "role": "reference",
    "primaryKey": [
     "c_a"
    ],
    "grain": "هر غذای این گروه"
   }
  }
 ]
}
