{
 "schema_version": 1,
 "unit": "u-wb-mavade_avalie-s4",
 "attempt": 1,
 "decisions": [
  {
   "skeleton": "S-rec-ecd3c0bb1713",
   "action": "keep",
   "key": "mavad_lazania",
   "title": "مواد اولیهٔ لازانیا",
   "statement": "مقدار هر ماده اولیه برای هر غذای گروه لازانیا در این جدول نگهداری می‌شود.",
   "data": {
    "role": "reference",
    "primaryKey": [
     "c_a"
    ],
    "grain": "هر غذای این گروه"
   }
  }
 ]
}
