{
 "schema_version": 1,
 "unit": "u-wb-mavade_avalie-s7",
 "attempt": 1,
 "decisions": [
  {
   "skeleton": "S-rec-6f06c2309913",
   "action": "keep",
   "key": "mavad_sandvich",
   "title": "مواد اولیهٔ ساندویچ",
   "statement": "مقدار هر ماده اولیه برای هر غذای گروه ساندویچ در این جدول نگهداری می‌شود.",
   "data": {
    "role": "reference",
    "primaryKey": [
     "c_a"
    ],
    "grain": "هر غذای این گروه"
   }
  }
 ]
}
