{
 "schema_version": 1,
 "unit": "u-wb-fried-s1",
 "attempt": 1,
 "decisions": [
  {
   "skeleton": "S-rec-a1440cef3fb8",
   "action": "keep",
   "key": "mojudi_aval_shab_sokhari",
   "title": "موجودی اول شب لاین سوخاری",
   "statement": "شمارش موجودی اقلام لاین سوخاری در آغاز شب کاری.",
   "data": {
    "role": "log",
    "cadence": "nightly",
    "day_boundary": "01:15"
   }
  }
 ],
 "new": []
}
