{
  "schema_version": 1,
  "unit": "u-tr-preparation-1405-05-28-02-l1",
  "attempt": 1,
  "decisions": [],
  "new": [
    {
      "kind": "record",
      "key": "form_darkhast_ruzane_anbar",
      "title": "فرم درخواست روزانهٔ انبار",
      "statement": "فرم کاغذی روزانه‌ای که انبار برای آماده‌سازی می‌نویسد و برای هر قلم مقدار کل درخواستی روز و سهم شعبهٔ مرکزی و سهم شعبه را جداگانه مشخص می‌کند. کار روزانهٔ آماده‌سازی بر پایهٔ همین فرم تعیین می‌شود و قلمی که در فرم نیامده باشد آن روز آماده نمی‌شود.",
      "aliases": [
        "فرم نیازها",
        "لیست درخواست روزانه"
      ],
      "processes": [
        {
          "process": "preparation-003",
          "node": "preparation-003-n017",
          "quote": "اینا چیزهایی که انبار به ما سفارش میده"
        },
        {
          "process": "preparation-017",
          "node": "preparation-017-n005",
          "quote": "سس قارچ چهار کیلو، دو کیلو مرکزی، دو کیلو شعبه"
        },
        {
          "process": "preparation-032",
          "node": "preparation-032-n005",
          "quote": "طی نظریه انبار جلو میریم"
        }
      ],
      "data": {
        "medium": "paper",
        "role": "log",
        "location": {
          "kept_at": "بخش آماده‌سازی",
          "holder": "سرپرست آماده‌سازی"
        },
        "cadence": "daily",
        "grain": "هر قلم درخواستی در هر روز",
        "filled_by": "انباردار",
        "approved_by": null,
        "fields": [
          {
            "key": "qalam",
            "title": "نام قلم",
            "type": "string",
            "description": "نام مادهٔ اولیه یا محصولی که انبار آن روز از آماده‌سازی خواسته است."
          },
          {
            "key": "meqdar_kol",
            "title": "مقدار کل",
            "type": "number",
            "unit": "kg",
            "description": "مقدار کل درخواستی آن قلم برای همان روز."
          },
          {
            "key": "sahm_markazi",
            "title": "سهم شعبهٔ مرکزی",
            "type": "number",
            "unit": "kg",
            "description": "بخشی از مقدار کل که سهم شعبهٔ مرکزی است."
          },
          {
            "key": "sahm_shobe",
            "title": "سهم شعبه",
            "type": "number",
            "unit": "kg",
            "description": "بخشی از مقدار کل که سهم شعبهٔ دیگر است."
          }
        ],
        "primaryKey": [
          "qalam"
        ]
      }
    },
    {
      "kind": "record",
      "key": "form_tabdil",
      "title": "فرم تبدیل",
      "statement": "فرم کاغذی که برای هر قلم و در هر لاین وزن مادهٔ اولیهٔ ورودی، وزن محصول خروجی و وزن ضایعات و دورریز میان این دو را ثبت می‌کند. مسئول همان لاین آن را پر می‌کند و به سرپرست آماده‌سازی تحویل می‌دهد. لاین سبزیجات چنین فرمی ندارد و آمار ورودی، خروجی و ضایعات خود را در دفتر می‌نویسد.",
      "processes": [
        {
          "process": "preparation-017",
          "node": "preparation-017-n021",
          "quote": "فرم تبدیل دارن برای هر چیزی"
        },
        {
          "process": "preparation-013",
          "node": "preparation-013-n045",
          "quote": "تحویل فرم تبدیل به سرپرست"
        },
        {
          "process": "preparation-005",
          "node": "preparation-005-n008",
          "quote": "به جز سبزیجات همه موارد فرم تبدیل دارن"
        }
      ],
      "data": {
        "medium": "paper",
        "role": "log",
        "location": {
          "kept_at": "بخش آماده‌سازی",
          "holder": "سرپرست آماده‌سازی"
        },
        "cadence": "daily",
        "grain": "هر قلم در هر لاین در هر روز",
        "filled_by": "مسئول لاین",
        "approved_by": "سرپرست آماده‌سازی",
        "fields": [
          {
            "key": "qalam",
            "title": "نام قلم",
            "type": "string",
            "description": "نام مادهٔ اولیه‌ای که روی آن کار انجام شده است."
          },
          {
            "key": "vazn_vorudi",
            "title": "وزن ورودی",
            "type": "number",
            "unit": "kg",
            "description": "وزن مادهٔ اولیه هنگام تحویل گرفتن از انبار و پیش از شروع کار."
          },
          {
            "key": "vazn_khoruji",
            "title": "وزن خروجی",
            "type": "number",
            "unit": "kg",
            "description": "وزن محصول آمادهٔ بسته‌بندی‌شده پس از پایان کار."
          },
          {
            "key": "vazn_zayeat",
            "title": "وزن ضایعات و دورریز",
            "type": "number",
            "unit": "kg",
            "description": "وزن هر چه میان ورودی و خروجی جدا می‌شود: پوست، کاور پلاستیکی، خونابه و تکه‌های غیرقابل استفاده."
          }
        ],
        "primaryKey": [
          "qalam"
        ]
      }
    },
    {
      "kind": "measurement",
      "key": "tozin_vorudi_khoruji_line",
      "title": "توزین ورودی، خروجی و دورریز هر لاین",
      "statement": "هر لاین مادهٔ اولیهٔ تحویل‌گرفته را پیش از شروع کار توزین می‌کند و محصول آمادهٔ خود را هنگام تحویل دوباره توزین می‌کند؛ پوست، کاور پلاستیکی، خونابه و دیگر دورریزها هم جداگانه وزن و ثبت می‌شوند. همهٔ این وزن‌ها بر حسب کیلوگرم و توسط مسئول همان لاین ثبت می‌شود.",
      "processes": [
        {
          "process": "preparation-026",
          "node": "preparation-026-n001",
          "quote": "اول ورودی وزن‌کشی می‌کنه خروجی هم وزن‌کشی می‌کنه"
        },
        {
          "process": "preparation-017",
          "node": "preparation-017-n011",
          "quote": "باز کردن رول و جدا کردن پوست و کاور پلاستیکی"
        }
      ],
      "data": {
        "quantity": "mass",
        "unit": "kg",
        "method": "توزین با ترازو؛ برای دورریز و خونابه هیچ وزن فرضی در نظر گرفته نمی‌شود و هر بار عدد ترازو نوشته می‌شود.",
        "when": "پیش از شروع کار روی مادهٔ اولیه و پس از آماده شدن محصول",
        "by": "مسئول لاین",
        "exceptions": null
      }
    },
    {
      "kind": "rule",
      "key": "vazn_pust_rol_zhambon",
      "title": "وزن پوست هر رول ژامبون",
      "statement": "هر رول ژامبون حدود چهار کیلوگرمی نزدیک به ۱۷۰ گرم پوست دارد که هنگام باز کردن رول جدا و به عنوان دورریز وزن می‌شود. برخی ژامبون‌ها دو لایه پوست دارند و وزن پوستشان بیشتر است.",
      "processes": [
        {
          "process": "preparation-017",
          "node": "preparation-017-n011",
          "quote": "تو هر یه رولش ۱۷۰ گرم پوست داره. توی چهار کیلوش"
        }
      ],
      "data": {
        "lang": null,
        "expr": null,
        "original": "تو هر یه رولش جسارتا ۱۷۰ گرم پوست داره. توی چهار کیلوش.",
        "inputs": [],
        "outputs": [
          {
            "key": "vazn_pust",
            "title": "وزن پوست هر رول",
            "unit": "g",
            "value": 170,
            "nature": "standard"
          }
        ]
      }
    },
    {
      "kind": "rule",
      "key": "mabnaye_shomaresh_zayeat",
      "title": "مبنای شمارش ضایعات در آماده‌سازی",
      "statement": "قلمی که هنگام تحویل گرفتن از انبار سالم نباشد اصلاً تحویل گرفته نمی‌شود و به انبار برمی‌گردد، پس ضایعات به شمار نمی‌آید. ضایعات تنها بخشی است که پس از تحویل گرفتن غیرقابل استفاده شود و وزن آن ثبت و همان روز به انبار تحویل می‌شود. پوست، کاور پلاستیکی و خونابه دورریز شمرده می‌شوند و جای جداگانه‌ای در ثبت دارند.",
      "processes": [
        {
          "process": "preparation-004",
          "node": "preparation-004-n005",
          "quote": "اگه بد باشه تحویل نمی‌گیره"
        }
      ],
      "data": {
        "lang": "text",
        "expr": null,
        "original": "جسارت نباشه آماده‌سازی ضایعات نداره. دورریز داره. چون همونو صبح تحویل می‌گیره اگه بد باشه تحویل نمی‌گیره. ضایعات تحویل انبار داده میشه.",
        "inputs": [
          {
            "key": "vaziat_qalam",
            "title": "وضعیت قلم هنگام تحویل گرفتن",
            "from": null
          }
        ],
        "outputs": [
          {
            "key": "dastebandi_zayeat",
            "title": "دسته‌بندی ضایعات یا دورریز",
            "nature": null
          }
        ]
      }
    },
    {
      "kind": "rule",
      "key": "tahvil_ruzane_tolid_be_anbar",
      "title": "تحویل کامل تولید روز به انبار",
      "statement": "هر چه آماده‌سازی در طول روز تولید می‌کند همان روز به انبار تحویل داده می‌شود. به همین دلیل آماده‌سازی ماندهٔ پایان شب ندارد و فرم ماندهٔ شب پر نمی‌کند؛ کار روز بعد دوباره با فرم درخواست روزانه آغاز می‌شود.",
      "data": {
        "lang": "text",
        "expr": null,
        "original": "مانده شب نداریم. چون همه چی رو همون روز تحویل انبار میدن.",
        "inputs": [
          {
            "key": "tolid_ruz",
            "title": "محصول آمادهٔ همان روز",
            "from": null
          }
        ],
        "outputs": [
          {
            "key": "zaman_tahvil",
            "title": "زمان تحویل به انبار",
            "value": "همان روز",
            "nature": null
          }
        ]
      }
    },
    {
      "kind": "note",
      "key": "abham_zarib_tabdil",
      "title": "ابهام در فهرست اقلام دارای ضریب تبدیل",
      "statement": "فهرست اقلامی که ضریب تبدیل دارند روشن نیست؛ دربارهٔ برخی اقلام میان گویندگان اختلاف نظر وجود داشت و باید با سرپرست آماده‌سازی نهایی شود.",
      "data": {
        "about": [
          {
            "ref": "S-rec-3d5d67801f5d"
          }
        ],
        "question": "کدام اقلام ضریب تبدیل دارند و کدام ندارند؟ سبزیجات، قارچ و فلفل دلمه‌ای بدون ضریب اعلام شد، اما دربارهٔ پاستا که وزنش پس از پخت تغییر می‌کند دو نظر متفاوت گفته شد."
      }
    }
  ]
}
