{
 "schema_version": 1,
 "unit": "u-wb-fried",
 "attempt": 1,
 "decisions": [
  {
   "skeleton": "S-rec-a1440cef3fb8",
   "action": "keep",
   "key": "mojudi_aval_shab_sokhari",
   "title": "موجودی اول شب لاین سوخاری",
   "statement": "شمارش موجودی اقلام لاین سوخاری در آغاز شب کاری.",
   "data": {
    "role": "log",
    "cadence": "nightly",
    "day_boundary": "01:15"
   }
  },
  {
   "skeleton": "S-rec-5d323801cf94",
   "action": "keep",
   "key": "mojudi_akhar_shab_sokhari",
   "title": "موجودی آخر شب لاین سوخاری",
   "statement": "شمارش موجودی اقلام لاین سوخاری در پایان شب، پس از بسته شدن رستوران.",
   "data": {
    "role": "log",
    "cadence": "nightly",
    "day_boundary": "01:15",
    "movement": {
     "to": {
      "ref": "N-u-wb-fried-0"
     },
     "reason": "باقی‌ماندهٔ اقلام لاین در پایان شب به انبار مرکزی برگردانده می‌شود."
    }
   }
  }
 ],
 "new": [
  {
   "kind": "record",
   "key": "daftar_tahvil_anbar_markazi",
   "title": "دفتر تحویل انبار مرکزی",
   "statement": "دفتر کاغذی انبار مرکزی که تحویل و برگشت اقلام لاین‌ها در آن نوشته می‌شود.",
   "data": {
    "medium": "paper",
    "role": "log",
    "location": {
     "kept_at": "انبار مرکزی",
     "holder": "انباردار"
    },
    "cadence": "nightly"
   }
  }
 ]
}
